{
  "version": 1,
  "adapter": "claude",
  "instructions_path": ".claude-plugin/settings.md",
  "project_config_path": null,
  "hooks_path": ".claude-plugin/hooks",
  "agents_path": ".claude-plugin/subagents",
  "worker_launch_command": "python3 -m workflow.scripts.harness_config build-worker-launch --repo-root .",
  "extension_points": {
    "mcp_config_path": ".claude-plugin/extensions.md",
    "resources_path": null,
    "tool_overrides_path": null,
    "notes_path": ".claude-plugin/extensions.md"
  },
  "compatibility": null
}
