{
  "version": 1,
  "adapter": "codex",
  "instructions_path": "AGENTS.md",
  "project_config_path": ".codex/config.toml",
  "hooks_path": ".codex/hooks.json",
  "agents_path": ".codex/agents",
  "worker_launch_command": "python3 -m praxis.runtime.workers.launcher --repo-root .",
  "extension_points": {
    "mcp_config_path": ".codex/extensions.md",
    "resources_path": null,
    "tool_overrides_path": null,
    "notes_path": ".codex/extensions.md"
  }
}
